{
  "contract_version": "argus-agentflow-p1/v1",
  "task_id": "task-empty",
  "run": {
    "run_id": "run-empty",
    "status": "completed",
    "topology_version": "p1-fixed-dag-v1",
    "input_digest": "sha256:0000000000000000000000000000000000000000000000000000000000000000"
  },
  "events": [
    {
      "id": "event-1",
      "sequence": 1,
      "timestamp": "2026-04-27T00:00:00Z",
      "event_type": "report_generated",
      "role": "audit-reporter",
      "visibility": "user",
      "correlation_id": "run-empty:event-1",
      "topology_version": "p1-fixed-dag-v1",
      "node_id": "audit-reporter",
      "message": "智能审计报告已生成",
      "data": {}
    }
  ],
  "checkpoints": [],
  "findings": [],
  "report": {
    "title": "智能审计报告",
    "summary": "未发现可确认漏洞",
    "verified_count": 0,
    "findings_count": 0,
    "severity_counts": {}
  },
  "agent_tree": [],
  "artifacts": [],
  "diagnostics": {}
}
